asin,price,imUrl,title
B0068VM5T4,,http://ecx.images-amazon.com/images/I/418CkFY1keL._SX342_.jpg,Tasc Performance Men's Carrollton Performance Running Tee Shirt
B006PTMYHM,36.49,http://ecx.images-amazon.com/images/I/31tZD1UDGiL._SY300_.jpg,Tapco Intrafuse AR Armorer's Tool
B006QF3TW4,19.89,http://ecx.images-amazon.com/images/I/41n5tg45TFL._SY300_.jpg,LifeStraw Personal Water Filter
B006X9DLQM,18.99,http://ecx.images-amazon.com/images/I/41CB19pGgmL._SY300_.jpg,GDT AR15 AR 15 Front and Rear 45 Degree Rapid Transition BUIS Backup Iron Sight
B0085PPSIQ,10,http://ecx.images-amazon.com/images/I/41nSrQhZCJL._SX300_.jpg,Lansky PS-MED01 BladeMedic
B0000C50K3,,http://ecx.images-amazon.com/images/I/41xc49yiI5L._SY300_.jpg,Hoppe's BoreSnake Rifle Bore Cleaner (Choose Your Caliber)
B000GCRWCG,7.1,http://ecx.images-amazon.com/images/I/31mXmL1n3dL._SY300_.jpg,Emergency Mylar Thermal Blankets (Pack of 10)
B000NLA4PM,12.99,http://ecx.images-amazon.com/images/I/417dSXbYHaL._SY300_.jpg,"Nalgene Tritan Wide Mouth BPA-Free Water Bottle, 1-Quart"
B00200E0HM,79,http://ecx.images-amazon.com/images/I/41aLtjFdxmL._SX300_.jpg,"Bushnell Trophy TRS-25 Red Dot Sight Riflescope, 1 x 25mm (tilted front lens)"
B0026OOS60,9.79,http://ecx.images-amazon.com/images/I/41O7ftG7k1L._SX300_.jpg,Chainmate Cm-24ssp 24-inch Survival Pocket Chain Saw with Pouch
B002OKWHVO,7.75,http://ecx.images-amazon.com/images/I/41LOIHxdfZL._SY300_.jpg,.223 Caliber Cartridge Laser Bore Sighter Boresighter
B0035L35A8,32.9,http://ecx.images-amazon.com/images/I/41JsCcRs5mL._SY300_.jpg,UTG Tactical OP Bipod - Tactical/Sniper Profile Adjustable Height
B00J2QLCFU,9.99,http://ecx.images-amazon.com/images/I/41nv60XrbBL._SY300_.jpg,"Rubbermaid  Shaker Bottle, 20-Ounce, Purple"
B004690CT0,9.28,http://ecx.images-amazon.com/images/I/319DBu%2BRgAL._SY300_.jpg,All Steel Over Size Tactical Latch
B004TNWD40,13.5,http://ecx.images-amazon.com/images/I/31RSOV7Bn4L._SX300_.jpg,"Morakniv Companion Fixed Blade Outdoor Knife with Sandvik Carbon Steel Blade, Military Green, 4.1-Inch"
B004U8CP88,5.74,http://ecx.images-amazon.com/images/I/41d1VuVFfmL._SY300_.jpg,Ultralight Backpacking Canister Camp Stove with Piezo Ignition 3.9oz
B00BGO0Q9O,92.85,http://ecx.images-amazon.com/images/I/21ukcP7LNVL._SX300_.jpg,"Fitbit Flex Wireless Activity + Sleep Wristband, Black"
B00C4E6ZK4,149.99,http://ecx.images-amazon.com/images/I/414Fof%2Bm%2BGL._SY300_.jpg,"Basis Health Tracker for Fitness, Sleep &amp; Stress - Black (Discontinued By Manufacturer)"
B00CWVP8PC,,http://ecx.images-amazon.com/images/I/41nbs5-plSL._SY300_.jpg,Baleaf Men's 3D Padded Coolmax Bicycle Cycling Underwear Shorts
B00FA2RLX2,19.04,http://ecx.images-amazon.com/images/I/51dg-%2BltkiL._SX300_.jpg,Sawyer Products Mini Water Filtration System
B000S5ODN2,,http://ecx.images-amazon.com/images/I/31ANU4HF1mL._SX300_.jpg,Rothco 550lb. Type III Nylon Paracord
B0010O748Q,3.99,http://ecx.images-amazon.com/images/I/41Ik8dIjUML._SY300_.jpg,Magnesium Fire Starter
B0014VX2M2,8.18,http://ecx.images-amazon.com/images/I/31c-ZYX%2BLcL._SX300_.jpg,GLOCK DISASSEMBLY TOOL
B00178CS4K,6.04,http://ecx.images-amazon.com/images/I/51ZBD6vD3SL._SX300_.jpg,Survivor HK-106320 Outdoor Fixed Blade Knife 7 Overall WITH FIRE STARTER
B001949TKS,6.29,http://ecx.images-amazon.com/images/I/51GFuGtgWGL._SY300_.jpg,Potable Aqua Water Treatment Tablets
B001E7S5BO,12.37,http://ecx.images-amazon.com/images/I/31zJirI5v9L._SY300_.jpg,Light My Fire Titanium Spork
B001HBHNHE,27.49,http://ecx.images-amazon.com/images/I/31gyd1PYsfL._SX300_.jpg,Butler Creek Lula Universal Pistol Magazine Loader
B001HBHNHY,23.47,http://ecx.images-amazon.com/images/I/419NdR8A-RL._SX300_.jpg,Butler Creek LULA All-in-One Magazine Speed Loader and Unloader 223 Remington 5.56mm NATO
B001T7QJ9O,48.99,http://ecx.images-amazon.com/images/I/41bcSICIjBL._SY300_.jpg,Howard Leight R-01526 Impact Sport Electronic Earmuff
